{
  "schema_version": "page_ground_truth.v1",
  "page_id": "d6a2c70d9472062b7f31b9443362b8e799d5ff471bd9db1b66a38998d744385f",
  "page_sha256": "d6a2c70d9472062b7f31b9443362b8e799d5ff471bd9db1b66a38998d744385f",
  "source_image": "samples/before_fix/__#Uf008_#Ueff9#Ue7cc (3).jpg",
  "fixture_source": "validation_samples/v032_caption_3_layout.json",
  "width": 2480,
  "height": 3508,
  "regions": [
    {
      "region_key": "d6a2c70d9472:g000",
      "page_sha256": "d6a2c70d9472062b7f31b9443362b8e799d5ff471bd9db1b66a38998d744385f",
      "legacy_group_id": "g000",
      "bbox": {
        "x": 2187,
        "y": 1642,
        "width": 251,
        "height": 648
      },
      "reading_order_index": 0,
      "source_text": {
        "raw": "今は日本の学校に潜入している",
        "nfc": "今は日本の学校に潜入している"
      },
      "fixed_translation": "現在正潛入日本的學校",
      "source_crop_sha256": "677092c4771a85d0e7cbd82ff4570171f9fddc37aa52aaa0d70ae45edb30a966",
      "verified_by": null,
      "verified_at": null,
      "provenance": {
        "method": "fixture_import",
        "source_path": "validation_samples/v032_caption_3_layout.json",
        "source_group_id": "g000"
      }
    },
    {
      "region_key": "d6a2c70d9472:g001",
      "page_sha256": "d6a2c70d9472062b7f31b9443362b8e799d5ff471bd9db1b66a38998d744385f",
      "legacy_group_id": "g001",
      "bbox": {
        "x": 1977,
        "y": 111,
        "width": 331,
        "height": 792
      },
      "reading_order_index": 1,
      "source_text": {
        "raw": "私の名前は「霜月シロエ」…",
        "nfc": "私の名前は「霜月シロエ」…"
      },
      "fixed_translation": "我的名字是「霜月白」…",
      "source_crop_sha256": "5d86c39f0a5d5c47823c0dcc923092f8d79ef4945f2f79d6ff71ac9f00da501f",
      "verified_by": null,
      "verified_at": null,
      "provenance": {
        "method": "fixture_import",
        "source_path": "validation_samples/v032_caption_3_layout.json",
        "source_group_id": "g001"
      }
    },
    {
      "region_key": "d6a2c70d9472:g002",
      "page_sha256": "d6a2c70d9472062b7f31b9443362b8e799d5ff471bd9db1b66a38998d744385f",
      "legacy_group_id": "g002",
      "bbox": {
        "x": 1983,
        "y": 985,
        "width": 58,
        "height": 292
      },
      "reading_order_index": 2,
      "source_text": {
        "raw": "偽名だけど…",
        "nfc": "偽名だけど…"
      },
      "fixed_translation": "雖然是假名…",
      "source_crop_sha256": "f2df3eaf9274d84574e8a5850539c6d2c5207d4d48fed41ed86790b7f6c0beab",
      "verified_by": null,
      "verified_at": null,
      "provenance": {
        "method": "fixture_import",
        "source_path": "validation_samples/v032_caption_3_layout.json",
        "source_group_id": "g002"
      }
    },
    {
      "region_key": "d6a2c70d9472:g003",
      "page_sha256": "d6a2c70d9472062b7f31b9443362b8e799d5ff471bd9db1b66a38998d744385f",
      "legacy_group_id": "g003",
      "bbox": {
        "x": 1338,
        "y": 1703,
        "width": 112,
        "height": 494
      },
      "reading_order_index": 3,
      "source_text": {
        "raw": "退屈な授業…",
        "nfc": "退屈な授業…"
      },
      "fixed_translation": "無聊的課…",
      "source_crop_sha256": "1eac8142aa8d8567cbaf50d1609dcbe46b4af8e82314f4e8d8d5fb3aaac8b9d4",
      "verified_by": null,
      "verified_at": null,
      "provenance": {
        "method": "fixture_import",
        "source_path": "validation_samples/v032_caption_3_layout.json",
        "source_group_id": "g003"
      }
    },
    {
      "region_key": "d6a2c70d9472:g004",
      "page_sha256": "d6a2c70d9472062b7f31b9443362b8e799d5ff471bd9db1b66a38998d744385f",
      "legacy_group_id": "g004",
      "bbox": {
        "x": 934,
        "y": 1632,
        "width": 251,
        "height": 916
      },
      "reading_order_index": 4,
      "source_text": {
        "raw": "私はデザイナーベイビーとして生まれ…",
        "nfc": "私はデザイナーベイビーとして生まれ…"
      },
      "fixed_translation": "我是作為設計師嬰兒出生的…",
      "source_crop_sha256": "9ae25418de2f5f546e8de9e6c4a9ffd92f24964449f36242944d25950d87fa1a",
      "verified_by": null,
      "verified_at": null,
      "provenance": {
        "method": "fixture_import",
        "source_path": "validation_samples/v032_caption_3_layout.json",
        "source_group_id": "g004"
      }
    },
    {
      "region_key": "d6a2c70d9472:g005",
      "page_sha256": "d6a2c70d9472062b7f31b9443362b8e799d5ff471bd9db1b66a38998d744385f",
      "legacy_group_id": "g005",
      "bbox": {
        "x": 180,
        "y": 765,
        "width": 301,
        "height": 625
      },
      "reading_order_index": 5,
      "source_text": {
        "raw": "某国の潜入捜査官だ",
        "nfc": "某国の潜入捜査官だ"
      },
      "fixed_translation": "某國的潛入搜查官",
      "source_crop_sha256": "17d98c4aba9bfbb4f7ac5524eb5e1e7bed584e9c23ae3ffd31d4928611f23545",
      "verified_by": null,
      "verified_at": null,
      "provenance": {
        "method": "fixture_import",
        "source_path": "validation_samples/v032_caption_3_layout.json",
        "source_group_id": "g005"
      }
    },
    {
      "region_key": "d6a2c70d9472:g006",
      "page_sha256": "d6a2c70d9472062b7f31b9443362b8e799d5ff471bd9db1b66a38998d744385f",
      "legacy_group_id": "g006",
      "bbox": {
        "x": 50,
        "y": 2227,
        "width": 231,
        "height": 562
      },
      "reading_order_index": 6,
      "source_text": {
        "raw": "あらゆる訓練を受け育った",
        "nfc": "あらゆる訓練を受け育った"
      },
      "fixed_translation": "接受了各種訓練長大了",
      "source_crop_sha256": "2c628801f0154c5fdee5b3a379f4569fbc0b128ff42c48dee4ee937dc2bcaf22",
      "verified_by": null,
      "verified_at": null,
      "provenance": {
        "method": "fixture_import",
        "source_path": "validation_samples/v032_caption_3_layout.json",
        "source_group_id": "g006"
      }
    }
  ]
}
